{
  "protocol": "tmux-observer.desktop.v1",
  "schemaVersion": 1,
  "clock": {
    "bootId": "00000000-0000-4000-8000-000000000000",
    "timeNamespace": "time:10"
  },
  "contextId": "00000000000000000000000000000000",
  "epoch": 1,
  "encodedAt": 130,
  "receipt": {
    "state": "ready",
    "startedAt": 100,
    "acceptedAt": 125,
    "expiresAt": 10100,
    "inputHash": "sha256:aaaaaaaaaaaaaaaaaaaaaaaaaaaaaaaaaaaaaaaaaaaaaaaaaaaaaaaaaaaaaaaa",
    "error": null
  },
  "dependencies": [
    {
      "hostId": "fixture-local",
      "local": false,
      "publisherId": "11111111-1111-4111-8111-111111111111",
      "serverGeneration": "tmux-v1:1700000000:4321:/tmp/tmux-fixture/default",
      "ownerExpiresAt": 10100,
      "associationExpiresAt": null
    }
  ],
  "rows": [
    {
      "sessionRef": {
        "hostId": "fixture-local",
        "serverGeneration": "tmux-v1:1700000000:4321:/tmp/tmux-fixture/default",
        "sessionId": "$2",
        "createdAt": 1700000001
      },
      "attachedClients": 1,
      "presence": {
        "state": "open",
        "confidence": "matched",
        "evidence": "launch_reference",
        "reason": null
      }
    }
  ]
}
